id,title,overview,genre_ids,vote_average,poster_path
480530,Creed II,"Between personal obligations and training for his next big fight against an opponent with ties to his family's past, Adonis Creed is up against the challenge of his life.","[18, 28]",7.033,/v3QyboWRoA4O9RbcsqH8tJMe8EB.jpg
85430,Girl Play,"Two real-life lesbian actresses meet by chance when they are cast as lovers in a local stage play, and end up actually falling in love. Robin, who is married to her girlfriend for half a dozen years, and Lacie, someone who never had a lasting relationship, are both cast to play lesbian lovers in a Los Angeles stage play. Innocently, the stage director, Gabriel runs the actresses through a series of rehearsals designed to ""bring out the intimacy"" in each performer. Soon the two women find themselves increasingly and undeniably attracted to each other and overcome with desire. They must ask themselves whether this relationship is manufactured, created for the sake of the ""girl play"", or is true love.","[35, 10749]",5.741,/8JoDrayY503p5a0vWZZFHbS9nD9.jpg
1291559,Drawing Closer,"With only a year left to live, 17-year-old Akito finds new meaning in life by bringing joy to a terminally ill girl who has just six months remaining.","[10749, 18]",8.388,/173FD4a0rpSF30z4CoWx6qdx8Ry.jpg
294254,Maze Runner: The Scorch Trials,"Thomas and his fellow Gladers face their greatest challenge yet: searching for clues about the mysterious and powerful organization known as WCKD. Their journey takes them to the Scorch, a desolate landscape filled with unimaginable obstacles. Teaming up with resistance fighters, the Gladers take on WCKD’s vastly superior forces and uncover its shocking plans for them all.","[878, 28, 53, 12]",6.734,/mYw7ZyejqSCPFlrT2jHZOESZDU3.jpg
9487,A Bug's Life,"On behalf of ""oppressed bugs everywhere,"" an inventive ant named Flik hires a troupe of warrior bugs to defend his bustling colony from a horde of freeloading grasshoppers led by the evil-minded Hopper.","[10751, 16, 12, 35]",6.972,/Ah3J9OJVc2CNCuH2zMydXy9fmIC.jpg
1106739,Juror #2,"While serving as a juror in a high profile murder trial, family man Justin Kemp finds himself struggling with a serious moral dilemma…one he could use to sway the jury verdict and potentially convict—or free—the accused killer.","[80, 18]",6.846,/ugQkpGajKFQ8eyOEhGheR0HfWQ.jpg
758323,The Pope's Exorcist,"Father Gabriele Amorth, Chief Exorcist of the Vatican, investigates a young boy's terrifying possession and ends up uncovering a centuries-old conspiracy the Vatican has desperately tried to keep hidden.","[27, 53]",6.948,/jFC4LS5qTAT3PinzdEzINfu1CV9.jpg
57214,Project X,"Three high school seniors throw a party to make a name for themselves. As the night progresses, things spiral out of control as word of the party spreads.",[35],6.888,/lUPDGT3lyRrq8SvWuNWG2DP64bR.jpg
390043,The Hitman's Bodyguard,"The world’s top bodyguard gets a new client, a hitman who must testify at the International Court of Justice. They must put their differences aside and work together to make it to the trial on time.","[28, 35, 80, 53]",6.9,/5CGjlz2vyBhW5xHW4eNOZIdgzYq.jpg
339846,Baywatch,"Devoted lifeguard Mitch Buchannon butts heads with a brash new recruit. Together, they uncover a local criminal plot that threatens the future of the Bay.","[35, 28, 80]",6.094,/6HE4xd8zloDqmjMZuhUCCw2UcY1.jpg
1181107,The King of Kings,"Charles Dickens tells his young son Walter the greatest story ever told, and what begins as a bedtime tale becomes a life-changing journey. Through vivid imagination, the boy walks alongside Jesus, witnessing His miracles, facing His trials, and understanding His ultimate sacrifice.","[10751, 14, 18, 12, 16]",8.6,/ccw7CCIAvcZV431CP7NhHAHuiHR.jpg
1458319,How to Train Your Dragon 2,The second live-action adaptation of the animated trilogy. Plot TBA.,"[14, 12, 10751, 28]",0.0,/8HUBvnbizvTkGOZfxOZBjVSWFhi.jpg
336843,Maze Runner: The Death Cure,"Thomas leads his group of escaped Gladers on their final and most dangerous mission yet. To save their friends, they must break into the legendary Last City, a WCKD-controlled labyrinth that may turn out to be the deadliest maze of all. Anyone who makes it out alive will get answers to the questions the Gladers have been asking since they first arrived in the maze.","[878, 28, 12, 53]",7.1,/drbERzlA4cuRWhsTXfFOY4mRR4f.jpg
521029,Annabelle Comes Home,"Determined to keep Annabelle from wreaking more havoc, demonologists Ed and Lorraine Warren bring the possessed doll to the locked artifacts room in their home, placing her “safely” behind sacred glass and enlisting a priest’s holy blessing. But an unholy night of horror awaits as Annabelle awakens the evil spirits in the room, who all set their sights on a new target—the Warrens' ten-year-old daughter, Judy, and her friends.",[27],6.406,/qWsHMrbg9DsBY3bCMk9jyYCRVRs.jpg
2433,The Young Girls of Rochefort,"Delphine and Solange are two sisters living in Rochefort. Delphine is a dancing teacher and Solange composes and teaches the piano. Maxence is a poet and a painter. He is doing his military service. Simon owns a music shop, he left Paris one month ago to come back where he fell in love 10 years ago. They are looking for love, looking for each other, without being aware that their ideal partner is very close...","[10749, 35, 18]",7.672,/jtxhyGaYhurH6KsjvP1jV3dDypz.jpg
990,The Hustler,Fast Eddie Felson is a small-time pool hustler with a lot of talent but a self-destructive attitude. His bravado causes him to challenge the legendary Minnesota Fats to a high-stakes match.,"[18, 10749]",7.672,/snItsSViawjaadW9mlWUmGwR41R.jpg
845,Strangers on a Train,"Having met on a train, a smooth-talking psychotic socialite shares his theory on how two complete strangers can get away with murder to an amateur tennis player — a theory he plans to test out.","[80, 53]",7.67,/ihC083U7ef56Ui4x0P0dobojrZ1.jpg
869626,Marcel the Shell with Shoes On,"Marcel is an adorable one-inch-tall shell who ekes out a colorful existence with his grandmother Connie and their pet lint, Alan. Once part of a sprawling community of shells, they now live alone as the sole survivors of a mysterious tragedy. When a documentarian discovers them amongst the clutter of his Airbnb, his resulting short film brings Marcel millions of passionate fans, as well as unprecedented dangers and a new hope at finding his long-lost family.","[16, 35, 18, 10751]",7.67,/jaYmP4Ct8YLnxWAW2oYkUjeXtzm.jpg
1075,"Black Cat, White Cat","Matko is a small time hustler, living by the Danube with his 17-year-old son Zare. After a failed business deal he owes money to the much more successful gangster Dadan. Dadan has a sister, Afrodita, that he desperately wants to see get married so they strike a deal: Zare is to marry her.","[35, 10749, 80]",7.669,/xxQ9jgYf3xhbUTW98VtCjA1wMLv.jpg
435366,Fabricated City,"In real life, Kwon Yoo is unemployed, but in the virtual game world he is the best leader. Kwon Yoo is then framed for a murder. With the help of hacker Yeo-Wool, he tries to uncover the truth behind the murder case.","[28, 53, 80]",7.668,/8tE4MhhuWHize6pNyxAtakUyNZc.jpg
11474,The Warriors,"Prominent gang leader Cyrus calls a meeting of New York's gangs to set aside their turf wars and take over the city. At the meeting, a rival leader kills Cyrus, but a Coney Island gang called the Warriors is wrongly blamed for Cyrus' death. Before you know it, the cops and every gangbanger in town is hot on the Warriors' trail.","[28, 53]",7.666,/fCDXAJcPvpsMd5CL1kBKkkNGW3X.jpg
4808,Charade,"After Regina Lampert falls for the dashing Peter Joshua on a skiing holiday in the French Alps, she discovers upon her return to Paris that her husband has been murdered. Soon, she and Peter are giving chase to three of her late husband's World War II cronies, Tex, Scobie and Gideon, who are after a quarter of a million dollars the quartet stole while behind enemy lines.","[35, 9648, 10749]",7.667,/qqaPjC5FQidtKY65jbAKZPiOTaS.jpg
11787,Harvey,"The story of Elwood P. Dowd who makes friends with a spirit taking the form of a human-sized rabbit named Harvey that only he sees (and a few privileged others on occasion also.) After his sister tries to commit him to a mental institution, a comedy of errors ensues. Elwood and Harvey become the catalysts for a family mending its wounds and for romance blossoming in unexpected places.","[35, 14]",7.666,/dgd82hYmpiXDM1G867HqNaWe8wj.jpg
1908,Inherit the Wind,"Schoolteacher Bertram Cates is arrested for teaching his students Darwin's theory of evolution. The case receives national attention and one of the newspaper reporters, E.K. Hornbeck, arranges to bring in renowned defense attorney and atheist Henry Drummond to defend Cates. The prosecutor, Matthew Brady is a former presidential candidate, famous evangelist, and old adversary of Drummond.",[18],7.7,/7oaHcF0gCOt2lKaT2zajhajP0Zo.jpg
1632,Mississippi Burning,"Two FBI agents investigating the murder of civil rights workers during the 60s seek to breach the conspiracy of silence in a small Southern town where segregation divides black and white. The younger agent trained in FBI school runs up against the small town ways of his partner, a former sheriff.","[18, 80, 9648, 53]",7.666,/hTv8Bkq3W1vwKi1IWCLWQW9PNU4.jpg
30020,Taste of Cherry,"A middle-aged Tehranian man, Mr. Badii is intent on killing himself and seeks someone to bury him after his demise. Driving around the city, the seemingly well-to-do Badii meets with numerous people, including a Muslim student, asking them to take on the job, but initially he has little luck. Eventually, Badii finds a man who is up for the task because he needs the money, but his new associate soon tries to talk him out of committing suicide.",[18],7.666,/u6GYH4HyR0BVwpqFuTOc2g4KB1L.jpg
1587,What's Eating Gilbert Grape,"Gilbert Grape is a small-town young man with a lot of responsibility. Chief among his concerns are his mother, who is so overweight that she can't leave the house, and his mentally impaired younger brother, Arnie, who has a knack for finding trouble. Settled into a job at a grocery store and an ongoing affair with local woman Betty Carver, Gilbert finally has his life shaken up by the free-spirited Becky.","[10749, 18]",7.665,/8r9yts6XHbB1xNLaPC6ExNAK1Qu.jpg
68,Brazil,"Low-level bureaucrat Sam Lowry escapes the monotony of his day-to-day life through a recurring daydream of himself as a virtuous hero saving a beautiful damsel. Investigating a case that led to the wrongful arrest and eventual death of an innocent man instead of wanted terrorist Harry Tuttle, he meets the woman from his daydream, and in trying to help her gets caught in a web of mistaken identities, mindless bureaucracy and lies.","[35, 878]",7.665,/aewan59WcFThBimkTVVoNf2o5Vb.jpg
724495,The Woman King,"The story of the Agojie, the all-female unit of warriors who protected the African Kingdom of Dahomey in the 1800s with skills and a fierceness unlike anything the world has ever seen, and General Nanisca as she trains the next generation of recruits and readies them for battle against an enemy determined to destroy their way of life.","[28, 18, 36]",7.664,/438QXt1E3WJWb3PqNniK0tAE5c1.jpg
247,The Killing,"Career criminal Johnny Clay recruits a sharpshooter, a crooked police officer, a bartender and a betting teller named George, among others, for one last job before he goes straight and gets married. But when George tells his restless wife about the scheme to steal millions from the racetrack where he works, she hatches a plot of her own.","[80, 53]",7.657,/A6VzUPcADZGYdGHlVdWvpMNDF5d.jpg
51739,The Secret World of Arrietty,"14-year-old Arrietty and the rest of the Clock family live in peaceful anonymity as they make their own home from items ""borrowed"" from the house's human inhabitants. However, life changes for the Clocks when a human boy discovers Arrietty.","[14, 16, 10751]",7.663,/3lSRaSjDp2nkXMQkzzjpRi3035O.jpg
9912,The World's Fastest Indian,"The life story of New Zealander Burt Munro, who spent years building a 1920 Indian motorcycle—a bike which helped him set the land-speed world record at Utah's Bonneville Salt Flats in 1967.","[18, 12, 36]",7.7,/vUIwPFAAXeCUuS040uGC0xSatcG.jpg
238628,Tangerines,"War in Abkhazia, 1992. An Estonian man Ivo has stayed behind to harvest his crops of tangerines. In a bloody conflict at his door, a wounded man is left behind, and Ivo is forced to take him in.","[18, 10752]",7.658,/jNKUXcwZr1vpgq7sGTCEqdngo4Z.jpg
36557,Casino Royale,"Le Chiffre, a banker to the world's terrorists, is scheduled to participate in a high-stakes poker game in Montenegro, where he intends to use his winnings to establish his financial grip on the terrorist market. M sends Bond—on his maiden mission as a 00 Agent—to attend this game and prevent Le Chiffre from winning. With the help of Vesper Lynd and Felix Leiter, Bond enters the most important poker game in his already dangerous career.","[12, 28, 53]",7.561,/lMrxYKKhd4lqRzwUHAy5gcx9PSO.jpg
365177,Borderlands,"Returning to her home planet, an infamous bounty hunter forms an unexpected alliance with a team of unlikely heroes. Together, they battle monsters and dangerous bandits to protect a young girl who holds the key to unimaginable power.","[28, 878, 35]",5.629,/4JGoZu1ZKFpMJTWAP35PCfkMgu8.jpg
11970,Hercules,"Bestowed with superhuman strength, a young mortal named Hercules sets out to prove himself a hero in the eyes of his father, the great god Zeus. Along with his friends Pegasus, a flying horse, and Phil, a personal trainer, Hercules is tricked by the hilarious, hotheaded villain Hades, who's plotting to take over Mount Olympus!","[16, 10751, 14, 12, 35, 10749]",7.499,/dK9rNoC97tgX3xXg5zdxFisdfcp.jpg
1252428,Anaconda,"A struggling circus crew gets deceived by its former partner, as it embarks on a tour in Thailand. During the journey through a Southeast Asian rainforest, they encounter attacks by a giant python. They meet a mysterious man named Jeff who offers to help, but they soon realize he's a poacher. As they search for Jeff's boat, they face life-and-death struggles with the python and Jeff himself.","[12, 27]",7.176,/9a7URTaq1Eimlg2ZujPX9FdOeGK.jpg
330457,Frozen II,"Elsa, Anna, Kristoff and Olaf head far into the forest to learn the truth about an ancient mystery of their kingdom.","[10751, 16, 12, 35, 14]",7.248,/mINJaa34MtknCYl5AjtNJzWj8cD.jpg
198184,Chappie,"Every child comes into the world full of promise, and none more so than Chappie: he is gifted, special, a prodigy. Like any child, Chappie will come under the influence of his surroundings—some good, some bad—and he will rely on his heart and soul to find his way in the world and become his own man. But there's one thing that makes Chappie different from any one else: he is a robot.","[80, 28, 878]",6.786,/uuDUpzlMFomdSfNWlpEPS9nVZWV.jpg
1029281,Strange Darling,Nothing is what it seems when a twisted one-night stand spirals into a serial killer’s vicious murder spree.,"[80, 27, 53]",6.949,/kWNCRgt3ocv19bYO0sk7TRuZuFY.jpg
4247,Scary Movie,"A familiar-looking group of teenagers find themselves being stalked by a more-than-vaguely recognizable masked killer! As the victims begin to pile up and the laughs pile on, none of your favorite scary movies escape the razor-sharp satire of this outrageously funny parody!",[35],6.369,/fVQFPRuw3yWXojYDJvA5EoFjUOY.jpg
337401,Mulan,"When the Emperor of China issues a decree that one man per family must serve in the Imperial Chinese Army to defend the country from Huns, Hua Mulan, the eldest daughter of an honored warrior, steps in to take the place of her ailing father. She is spirited, determined and quick on her feet. Disguised as a man by the name of Hua Jun, she is tested every step of the way and must harness her innermost strength and embrace her true potential.","[12, 14, 28]",6.858,/aKx1ARwG55zZ0GpRvU2WrGrCG9o.jpg
76492,Hotel Transylvania,"Welcome to Hotel Transylvania, Dracula's lavish five-stake resort, where monsters and their families can live it up and no humans are allowed. One special weekend, Dracula has invited all his best friends to celebrate his beloved daughter Mavis's 118th birthday. For Dracula catering to all of these legendary monsters is no problem but the party really starts when one ordinary guy stumbles into the hotel and changes everything!","[16, 35, 10751, 14]",6.962,/3sKT6vtydJ4DkTJtdP5pvfpPa0n.jpg
63197,Megan Is Missing,"Fourteen-year–old Megan and her best friend Amy spend a lot of time on the internet, posting videos of themselves and chatting with guys online. One night Megan chats with a guy named Josh who convinces her to meet him for a date. The next day, Megan is missing—forever. Based on actual cases of child abduction.","[18, 27, 53]",6.258,/vqFIC6miVQWBUrkQYk3Fe0jqXrD.jpg
339403,Baby Driver,"After being coerced into working for a crime boss, a young getaway driver finds himself taking part in a heist doomed to fail.","[28, 80]",7.445,/tYzFuYXmT8LOYASlFCkaPiAFAl0.jpg
599521,Z-O-M-B-I-E-S 2,"Zed and Addison are back at Seabrook High, where, after a groundbreaking semester, they continue to steer both their school and community toward unity. But the arrival of a new group of outsiders – mysterious werewolves – threatens to shake up the newfound peace and causes a rift in Zed and Addison’s budding romance.","[14, 10749, 10770]",7.5,/cOnxoQ3kx4mgmWb7yRi6GBWssOh.jpg
137113,Edge of Tomorrow,"Major Bill Cage is an officer who has never seen a day of combat when he is unceremoniously demoted and dropped into combat. Cage is killed within minutes, managing to take an alpha alien down with him. He awakens back at the beginning of the same day and is forced to fight and die again... and again - as physical contact with the alien has thrown him into a time loop.","[28, 878]",7.631,/c4BEWLbXyPiXNFaDt57HAgekCqw.jpg
1484267,Trainwreck: P.I. Moms,This tell-all documentary investigates an early 2000s reality show about private eye moms and the drug scandal that sabotaged the series and its stars.,[99],7.0,/gACBkTDNDP2GGspeFkn7AhCpiL3.jpg
110415,Snowpiercer,"In a future where a failed global-warming experiment kills off most life on the planet, a class system evolves aboard the Snowpiercer; a train that travels around the globe via a perpetual-motion engine.","[28, 878, 18]",6.905,/nzccOvhrLGI0nvAknCEAk8bchD9.jpg
268,Batman,"Batman must face his most ruthless nemesis when a deformed madman calling himself ""The Joker"" seizes control of Gotham's criminal underworld.","[14, 28, 80]",7.233,/cij4dd21v2Rk2YtUQbV5kW69WB2.jpg
408,Snow White and the Seven Dwarfs,"A beautiful girl, Snow White, takes refuge in the forest in the house of seven dwarfs to hide from her stepmother, the wicked Queen. The Queen is jealous because she wants to be known as ""the fairest in the land,"" and Snow White's beauty surpasses her own.","[14, 16, 10751]",7.122,/3VAHfuNb6Z7UiW12iYKANSPBl8m.jpg
78383,Nurse 3-D,"Abby Russell, a beautiful, dedicated nurse with a sinister side, has a secret life in which she targets and punishes dishonest men.","[27, 53]",5.325,/3OvX96gN6oTFmxRq2vrddZJubl5.jpg
12219,12 Angry Men,"During the trial of a man accused of his father's murder, a lone juror takes a stand against the guilty verdict handed down by the others as a result of their preconceptions and prejudices.","[18, 10770]",7.66,/whDdYx3lh1LHTN0VlPFt51fX29g.jpg
728118,"Quo Vadis, Aida?","Bosnia, July 1995. Aida is a translator for the UN in the small town of Srebrenica. When the Serbian army takes over the town, her family is among the thousands of citizens looking for shelter in the UN camp. As an insider to the negotiations Aida has access to crucial information that she needs to interpret. What is at the horizon for her family and people – rescue or death? Which move should she take?","[10752, 18, 36]",7.66,/eQy2Tgvmx0FkK8vMMqMW4aX5UXQ.jpg
575452,The Traitor,"Palermo, Sicily, 1980. Mafia member Tommaso Buscetta decides to move to Brazil with his family fleeing the constant war between the different clans of the criminal organization. But when, after living several misfortunes, he is forced to return to Italy, he makes a bold decision that will change his life and the destiny of Cosa Nostra forever.","[18, 80, 53]",7.7,/bjb1zKlyw85hYwDXzz2UM6XqjUU.jpg
508439,Onward,"In a suburban fantasy world, two teenage elf brothers embark on an extraordinary quest to discover if there is still a little magic left out there.","[10751, 35, 12, 16, 14]",7.66,/f4aul3FyD3jv3v4bul1IrkWZvzq.jpg
49992,Lucky and Zorba,"A seagull is caught by the black tide of a sinking petrol ship. She manages to fly inland and falls down in a garden by a cat. Moribund, she asks the cat to fulfill three promises: that when she lays her egg he must not eat it; that he must take care of it until it hatches; that he would teach the newborn how to fly.","[10751, 16]",7.66,/9tuNSBnodER4Dxot2b2fmbCvIEM.jpg
8358,Cast Away,"Chuck Noland, a top international manager for FedEx, and Kelly, a Ph.D. student, are in love and heading towards marriage. Then Chuck's plane to Malaysia crashes at sea during a terrible storm. He's the only survivor, and finds himself marooned on a desolate island. With no way to escape, Chuck must find ways to survive in his new home.","[12, 18]",7.66,/7lLJgKnAicAcR5UEuo8xhSMj18w.jpg
1592,Primal Fear,"An arrogant, high-powered attorney takes on the case of a poor altar boy found running away from the scene of the grisly murder of the bishop who has taken him in. The case gets a lot more complex when the accused reveals that there may or may not have been a third person in the room.","[80, 18, 9648, 53]",7.659,/qJf2TzE8nRTFbFMPJNW6c8mI0KU.jpg
8416,The Conformist,"A weak-willed Italian man becomes a fascist flunky who goes abroad to arrange the assassination of his old teacher, now a political dissident.",[18],7.659,/nLJjFRqIJAK8qz0OKYnpKCblZNK.jpg
1904,Memoirs of a Geisha,"In the years before World War II, a penniless Japanese child is torn from her family to work as a maid in a geisha house.","[18, 10749, 36]",7.659,/9twKlPKD5Qd2EXX8lohW4zL8zQ8.jpg
587272,Father There Is Only One,"Javier is what we have dubbed as a ""husband-in-law."" That is that without taking care of the care of the house and children at all, he knows exactly what needs to be done, and that he continuously collects a sum of sentences from the type: ""It is that you do not organize"", or ""do not get nervous"", you already consider that overflowing woman drowns in a glass of water. Javier will have to face the reality of dealing with five children (between four and twelve years old) when his wife decides to go on a trip and leave him alone with them. The chaotic situation that takes place at home will progressively evolve ecologically to the most absolute disaster, but at the same time it will give parents and children the opportunity to meet and enjoy themselves for the first time.",[35],7.657,/tW6V8C81lzYuRy8yFe1dvvGhL4j.jpg
15794,White Heat,"A psychopathic criminal with a mother complex makes a daring break from prison and then leads his old gang in a chemical plant payroll heist. After the heist, events take a crazy turn.","[80, 18, 53]",7.657,/v7cPOHKKZI9qChi7HDUxNIhEcLR.jpg
14580,The Big Heat,"After the suspicious suicide of a fellow cop, tough homicide detective Dave Bannion takes the law into his own hands when he sets out to smash a vicious crime syndicate.","[80, 53]",7.658,/n1xdAX2g6PU3aqQXmZtY9gXvvEz.jpg
100402,Captain America: The Winter Soldier,"After the cataclysmic events in New York with The Avengers, Steve Rogers, aka Captain America is living quietly in Washington, D.C. and trying to adjust to the modern world. But when a S.H.I.E.L.D. colleague comes under attack, Steve becomes embroiled in a web of intrigue that threatens to put the world at risk. Joining forces with the Black Widow, Captain America struggles to expose the ever-widening conspiracy while fighting off professional assassins sent to silence him at every turn. When the full scope of the villainous plot is revealed, Captain America and the Black Widow enlist the help of a new ally, the Falcon. However, they soon find themselves up against an unexpected and formidable enemy—the Winter Soldier.","[28, 12, 878]",7.655,/tVFRpFw3xTedgPGqxW0AOI8Qhh0.jpg
261,Cat on a Hot Tin Roof,"An alcoholic ex-football player drinks his days away, having failed to come to terms with his sexuality and his real feelings for his football buddy who died after an ambiguous accident. His wife is crucified by her desperation to make him desire her: but he resists the affections of his wife. His reunion with his father—who is dying of cancer—jogs a host of memories and revelations for both father and son.",[18],7.654,/reO2NXIYPeBqehTsmia0P9rSMDv.jpg
27040,Meshes of the Afternoon,"A woman returning home falls asleep and has vivid dreams that may or may not be happening in reality. Through repetitive images and complete mismatching of the objective view of time and space, her dark inner desires play out on-screen.","[9648, 14]",7.652,/pRLqidsUdxYM5pXLJ9mqm2n9U9K.jpg
812,Aladdin,"In the boorish city of Agrabah, kind-hearted street urchin Aladdin and Princess Jasmine fall in love, although she can only marry a prince. He and power-hungry Grand Vizier Jafar vie for a magic lamp that can fulfill their wishes.","[16, 10751, 12, 14, 10749]",7.653,/eLFfl7vS8dkeG1hKp5mwbm37V83.jpg
371645,Hunt for the Wilderpeople,"Ricky is a defiant young city kid who finds himself on the run with his cantankerous foster uncle in the wild New Zealand bush. A national manhunt ensues, and the two are forced to put aside their differences and work together to survive.","[12, 35, 18]",7.651,/hkmz9rxgcweizXNElozGeKwmAJE.jpg
