id,title,overview,genre_ids,vote_average,poster_path
823754,Bo Burnham: Inside,"Stuck in COVID-19 lockdown, US comedian and musician Bo Burnham attempts to stay sane and happy by writing, shooting and performing a one-man comedy special.","[35, 18]",8.026,/ku1UvTWYvhFQbSesOD6zteY7bXT.jpg
347688,Scooby-Doo! and Kiss: Rock and Roll Mystery,"Get ready to Rock! Scooby-Doo and the Mystery Inc. Gang team up with the one and only KISS in this all-new, out-of-this-world adventure! We join the Gang at KISS World – the all-things-KISS theme park, as they investigate a series of strange hauntings. With help from KISS, they discover that the Crimson Witch has returned to summon The Destroyer from the alternate dimension of Kissteria! The evil duos ghastly plan, to destroy the earth! Can the Gang's cunning and KISS's power of rock save the day?!","[10751, 16, 35, 9648]",8.0,/nTkQZPXZl9yx3tfPS9TSDZBdhHC.jpg
204,The Wages of Fear,"In a run-down South American town, four men are paid to drive trucks loaded with nitroglycerin into the jungle through to the oil field. Friendships are tested and rivalries develop as they embark upon the perilous journey.","[18, 53, 12]",8.026,/dZyZSosIlWcpQkV0f7pXcrV2TQV.jpg
147,The 400 Blows,"For young Parisian boy Antoine Doinel, life is one difficult situation after another. Surrounded by inconsiderate adults, including his neglectful parents, Antoine spends his days with his best friend, Rene, trying to plan for a better life. When one of their schemes goes awry, Antoine ends up in trouble with the law, leading to even more conflicts with unsympathetic authority figures.",[18],8.025,/12PuU23kkDLvTd0nb8hMlE3oShB.jpg
279,Amadeus,Disciplined Italian composer Antonio Salieri becomes consumed by jealousy and resentment towards the hedonistic and remarkably talented young Viennese composer Wolfgang Amadeus Mozart.,"[36, 10402, 18]",8.024,/1n5VUlCqgmVax1adxGZm8oCFaKc.jpg
838240,Robot Dreams,A lonely dog's friendship with his robot companion takes a sad turn when an unexpected malfunction forces him to abandon Robot at the beach. Will Dog ever meet Robot again?,"[16, 18, 35, 878]",8.023,/vSzOobYVu16MogSALNg1bjTaGc.jpg
43949,Flipped,"When Juli meets Bryce in the second grade, she knows it's true love. After spending six years trying to convince Bryce the same, she's ready to give up - until he starts to reconsider.","[10749, 18]",8.024,/6zDYFigohwncqFL00MKbFV01dWb.jpg
610461,"Veinteañera, divorciada y fantástica","Regina, our young protagonist, always dreamed of getting married. And she did it - but the dream lasted much less than she thought and now she has to face life in a very funny way as a divorcee.",[35],8.023,/oSbCdDI0SAAOdywGe0YVO2iDdV9.jpg
55960,"Toto, Peppino, and the Hussy","Antonio, Peppino and Lucia are three brothers who live in the country near Naples. Lucia's son, Gianni, goes to Naples to study medicine, but there he knows a ballet dancer. They fall in love and, when she goes to Milan, Gianni follows her. Informed of this and afraid that their nephew will stop studying, the three Caponi brothers leave for Milan to persuade Gianni to come back and continue studying and abandon the ""Malafemmina"" (bad girl).","[35, 10749]",8.021,/rHsc35TLPliJAvbnmu8dvddiu96.jpg
307,"Rome, Open City","In WWII-era Rome, underground resistance leader Manfredi attempts to evade the Gestapo by enlisting the help of Pina, the fiancée of a fellow member of the resistance, and Don Pietro, the priest due to oversee her marriage. But it’s not long before the Nazis and the local police find him.","[18, 10752]",8.021,/ijGV4v8JxgbNzgEhqKdzHdaZn8a.jpg
938,For a Few Dollars More,"Two bounty hunters both pursue the brutal and sadistic bandit, El Indio, who has a large bounty on his head.",[37],8.018,/ooqASvA7qxlTVKL3KwOzBwy57Dh.jpg
521,Dial M for Murder,"When American writer Mark Halliday visits the very married Margot Wendice in London, he unknowingly sets off a chain of blackmail and murder.","[53, 80]",8.018,/clyd4ONJgWYSw1a0UdlbZ6NYrNo.jpg
641,Requiem for a Dream,The drug-induced utopias of four Coney Island residents are shattered when their addictions run deep.,"[80, 18]",8.015,/nOd6vjEmzCT0k4VYqsA2hwyi87C.jpg
110416,Song of the Sea,"The story of the last Seal Child’s journey home. After their mother’s disappearance, Ben and Saoirse are sent to live with Granny in the city. When they resolve to return to their home by the sea, their journey becomes a race against time as they are drawn into a world Ben knows only from his mother’s folktales. But this is no bedtime story; these fairy folk have been in our world far too long. It soon becomes clear to Ben that Saoirse is the key to their survival.","[10751, 16, 14]",8.013,/16LQC6zpqB0l74mVWb93a2oMFnX.jpg
8422,Rocco and His Brothers,"When a impoverished widow’s family moves to the big city, two of her five sons become romantic rivals with deadly results.","[18, 10749]",8.014,/pngL8AraChIDOiWnKF2o3S9kJzJ.jpg
28178,Hachi: A Dog's Tale,A drama based on the true story of a college professor's bond with the abandoned dog he takes into his home.,"[18, 10751]",8.011,/lsy3aEsEfYIHdLRk4dontZ4s85h.jpg
400928,Gifted,"Frank, a single man raising his child prodigy niece Mary, is drawn into a custody battle with his mother.","[18, 35]",8.006,/7YB2YrMwIm1g8FyZtlvmVDfRnAT.jpg
868759,Ghosted,"Salt-of-the-earth Cole falls head over heels for enigmatic Sadie—but then makes the shocking discovery that she's a secret agent. Before they can decide on a second date, Cole and Sadie are swept away on an international adventure to save the world.","[28, 35, 10749]",6.95,/liLN69YgoovHVgmlHJ876PKi5Yi.jpg
767,Harry Potter and the Half-Blood Prince,"As Lord Voldemort tightens his grip on both the Muggle and wizarding worlds, Hogwarts is no longer a safe haven. Harry suspects perils may even lie within the castle, but Dumbledore is more intent upon preparing him for the final battle fast approaching. Together they work to find the key to unlock Voldemorts defenses and to this end, Dumbledore recruits his old friend and colleague Horace Slughorn, whom he believes holds crucial information. Even as the decisive showdown looms, romance blossoms for Harry, Ron, Hermione and their classmates. Love is in the air, but danger lies ahead and Hogwarts may never be the same again.","[12, 14]",7.683,/z7uo9zmQdQwU5ZJHFpv2Upl30i1.jpg
947891,My Old Ass,"An 18th birthday mushroom trip brings free-spirited Elliott face-to-face with her wisecracking 39-year-old self. But when Elliott’s ""old ass"" starts handing out warnings about what her younger self should and shouldn't do, Elliott realizes she has to rethink everything about family, love, and what's becoming a transformative summer.","[35, 18]",6.8,/yUs4Sw9AyTg2sA1qWBkNpD2mGSj.jpg
1359977,Conjuring the Cult,"After discovering his blood-soaked daughter dead in the bathtub, David Bryson attends a self-help group to help save him from his ghostly nightmares. But when a group of mysterious cult-like women offer to help him resurrect his daughter. David's choices will not just decide his fate... but the fate of his dead daughter's SOUL.","[27, 18]",5.6,/t4MiAeYpjL7saYvqvcn9xtOfA4K.jpg
547016,The Old Guard,Four undying warriors who've secretly protected humanity for centuries become targeted for their mysterious powers just as they discover a new immortal.,"[28, 14]",7.136,/cjr4NWURcVN3gW5FlHeabgBHLrY.jpg
315635,Spider-Man: Homecoming,"Following the events of Captain America: Civil War, Peter Parker, with the help of his mentor Tony Stark, tries to balance his life as an ordinary high school student in Queens, New York City, with fighting crime as his superhero alter ego Spider-Man as a new threat, the Vulture, emerges.","[28, 12, 878, 18]",7.331,/c24sv2weTHPsmDa7jEMN0m2P3RT.jpg
269149,Zootopia,"Determined to prove herself, Officer Judy Hopps, the first bunny on Zootopia's police force, jumps at the chance to crack her first case - even if it means partnering with scam-artist fox Nick Wilde to solve the mystery.","[16, 12, 10751, 35]",7.748,/hlK0e0wAQ3VLuJcsfIYPvb4JVud.jpg
1079346,5lbs of Pressure,"Fresh out of prison after serving time for murder, Adam returns to his old stomping grounds to seek out a son who doesn't know him. Eli, the brother of the man he killed is looking for revenge. Mike, is trying to escape a life of crime living under the thumb of his gangster Uncle.","[53, 80, 10749]",6.141,/toEJOPYvM7Na0XwM8exg8aHq553.jpg
1045938,G20,"After the G20 Summit is overtaken by terrorists, President Danielle Sutton must bring all her statecraft and military experience to defend her family and her fellow leaders.","[28, 9648, 18]",6.518,/wv6oWAleCJZUk5htrGg413t3GCy.jpg
748783,The Garfield Movie,"Garfield, the world-famous, Monday-hating, lasagna-loving indoor cat, is about to have a wild outdoor adventure! After an unexpected reunion with his long-lost father – scruffy street cat Vic – Garfield and his canine friend Odie are forced from their perfectly pampered life into joining Vic in a hilarious, high-stakes heist.","[10751, 35, 12, 16]",7.05,/xYduFGuch9OwbCOEUiamml18ZoB.jpg
1429784,Singsot: Siulan Kematian,"A kid defies the ancient taboo of whistling at dusk, unleashing a sinister terror tied to a cursed figure who made the same mistake. Bound by an inescapable curse, he’s thrust into a deadly race against time—because if he fails, the nightmare will become his new reality.",[27],6.667,/llZca2miwygKwuyWUpyONCL6VAR.jpg
823464,Godzilla x Kong: The New Empire,"Following their explosive showdown, Godzilla and Kong must reunite against a colossal undiscovered threat hidden within our world, challenging their very existence – and our own.","[28, 12, 878]",7.1,/z1p34vh7dEOnLDmyCrlUVLuoDzd.jpg
1506450,Sipsipan,"At Sipsipan, a shady stop where truckers trade fuel for cash and pleasure, one man’s craving leads him down a path of lust, lies, and no return.","[18, 10749]",7.5,/s8L60mdRK3aBhu9EjXFAvc0KiSQ.jpg
1249289,Alarum,"Two married spies caught in the crosshairs of an international intelligence network will stop at nothing to obtain a critical asset. Joe and Lara are agents living off the grid whose quiet retreat at a winter resort is blown to shreds when members of the old guard suspect the two may have joined an elite team of rogue spies, known as Alarum.","[28, 80, 53]",5.78,/v313aUGmMNj6yNveaiQXysBmjVS.jpg
9532,Final Destination,"After a teenager has a terrifying vision of him and his friends dying in a plane crash, he prevents the accident only to have Death hunt them down, one by one.",[27],6.625,/1mXhlQMnlfvJ2frxTjZSQNnA9Vp.jpg
58,Pirates of the Caribbean: Dead Man's Chest,"Captain Jack Sparrow races to recover the heart of Davy Jones to avoid enslaving his soul to Jones' service, as other friends and foes seek the heart for their own agenda as well.","[12, 14, 28]",7.367,/lAhcKRt0ggTFkeFL95jrGQYaRXs.jpg
637649,Wrath of Man,"A cold and mysterious new security guard for a Los Angeles cash truck company surprises his co-workers when he unleashes precision skills during a heist. The crew is left wondering who he is and where he came from. Soon, the marksman's ultimate motive becomes clear as he takes dramatic and irrevocable steps to settle a score.","[28, 80, 53]",7.606,/M7SUK85sKjaStg4TKhlAVyGlz3.jpg
14,American Beauty,"Lester Burnham, a depressed suburban father in a mid-life crisis, decides to turn his hectic life around after developing an infatuation with his daughter's attractive friend.",[18],8.007,/wby9315QzVKdW9BonAefg8jGTTb.jpg
20530,Late Spring,"Noriko is perfectly happy living at home with her widowed father, Shukichi, and has no plans to marry -- that is, until her aunt Masa convinces Shukichi that unless he marries off his 27-year-old daughter soon, she will likely remain alone for the rest of her life. When Noriko resists Masa's matchmaking, Shukichi is forced to deceive his daughter and sacrifice his own happiness to do what he believes is right.",[18],8.006,/iNtRSY2AGjW1VDXDR79bKsNUdus.jpg
359724,Ford v Ferrari,"American car designer Carroll Shelby and the British-born driver Ken Miles work together to battle corporate interference, the laws of physics, and their own personal demons to build a revolutionary race car for Ford Motor Company and take on the dominating race cars of Enzo Ferrari at the 24 Hours of Le Mans in France in 1966.","[18, 28, 36]",8.005,/dR1Ju50iudrOh3YgfwkAU1g2HZe.jpg
526702,Black Beauty,"Born free in the American West, Black Beauty is a horse rounded up and brought to Birtwick Stables, where she meets spirited teenager Jo Green. The two forge a bond that carries Beauty through the different chapters, challenges and adventures.",[18],8.004,/5ZjMNJJabwBEnGVQoR2yoMEL9um.jpg
568160,Weathering with You,"The summer of his high school freshman year, Hodaka runs away from his remote island home to Tokyo, and quickly finds himself pushed to his financial and personal limits. The weather is unusually gloomy and rainy every day, as if taking its cue from his life. After many days of solitude, he finally finds work as a freelance writer for a mysterious occult magazine. Then, one day, Hodaka meets Hina on a busy street corner. This bright and strong-willed girl possesses a strange and wonderful ability: the power to stop the rain and clear the sky.","[16, 18, 14, 10749]",8.002,/qgrk7r1fV4IjuoeiGS5HOhXNdLJ.jpg
515001,Jojo Rabbit,"A World War II satire that follows a lonely German boy whose world view is turned upside down when he discovers his single mother is hiding a young Jewish girl in their attic. Aided only by his idiotic imaginary friend, Adolf Hitler, Jojo must confront his blind nationalism.","[35, 10752, 18]",8.003,/1mqL7VG4Ix8wmxwypmCA1HTHBky.jpg
962232,Beyond the Universe,"While waiting for a kidney transplant, a young pianist finds an unexpected connection with her doctor — and the courage to fulfill her musical dreams.","[10749, 18, 10402]",8.002,/AlAP6WRSBuf5cP8OgpHTF45BPUp.jpg
264644,Room,"Held captive for 7 years in an enclosed space, a woman and her young son finally gain their freedom, allowing the boy to experience the outside world for the first time.","[18, 53]",8.002,/pCURNjeomWbMSdiP64gj8NVVHTQ.jpg
3175,Barry Lyndon,"An Irish rogue uses his cunning and wit to work his way up the social classes of 18th century England, transforming himself from the humble Redmond Barry into the noble Barry Lyndon.","[18, 10749, 10752, 36]",8.001,/x2JQCgLjieWOwvImeGtLmuNgsrq.jpg
414419,Kill Bill: The Whole Bloody Affair,"An assassin is shot and almost killed by her ruthless employer, Bill, and other members of their assassination circle – but she lives to plot her vengeance.","[28, 80, 53]",8.0,/nxbv9TPXrIpRKB5xQh6atWXAkPM.jpg
51822,Love Hurts,Family and friends try to sabotage the budding romance between a young upper class girl and a humble student.,"[18, 10749]",7.999,/eyhd9wLlyDTGOKl4jmzWy5sa90o.jpg
20453,3 Idiots,"Rascal. Joker. Dreamer. Genius... You've never met a college student quite like ""Rancho."" From the moment he arrives at India's most prestigious university, Rancho's outlandish schemes turn the campus upside down—along with the lives of his two newfound best friends. Together, they make life miserable for ""Virus,"" the school’s uptight and heartless dean. But when Rancho catches the eye of the dean's daughter, Virus sets his sights on flunking out the ""3 idiots"" once and for all.","[18, 35]",7.999,/66A9MqXOyVFCssoloscw79z8Tew.jpg
15,Citizen Kane,"Newspaper magnate Charles Foster Kane is taken from his mother as a boy and made the ward of a rich industrialist. As a result, every well-meaning, tyrannical or self-destructive move he makes for the rest of his life appears in some way to be a reaction to that deeply wounding event.","[9648, 18]",7.999,/sav0jxhqiH0bPr2vZFU0Kjt2nZL.jpg
947,Lawrence of Arabia,"The story of British officer T.E. Lawrence's mission to aid the Arab tribes in their revolt against the Ottoman Empire during the First World War. Lawrence becomes a flamboyant, messianic figure in the cause of Arab unity but his psychological instability threatens to undermine his achievements.","[12, 36, 10752]",7.997,/AiAm0EtDvyGqNpVoieRw4u65vD1.jpg
524,Casino,"In early-1970s Las Vegas, Sam ""Ace"" Rothstein gets tapped by his bosses to head the Tangiers Casino. At first, he's a great success in the job, but over the years, problems with his loose-cannon enforcer Nicky Santoro, his ex-hustler wife Ginger, her con-artist ex Lester Diamond and a handful of corrupt politicians put Sam in ever-increasing danger.","[80, 18]",7.998,/gziIkUSnYuj9ChCi8qOu2ZunpSC.jpg
906126,Society of the Snow,"On October 13, 1972, Uruguayan Air Force Flight 571, chartered to take a rugby team to Chile, crashes into a glacier in the heart of the Andes.","[18, 36]",7.996,/2e853FDVSIso600RqAMunPxiZjq.jpg
11658,Tae Guk Gi: The Brotherhood of War,"When two brothers are forced to fight in the Korean War, the elder decides to take the riskiest missions if it will help shield the younger from battle.","[28, 12, 18, 36, 10752]",8.0,/vyG8qpimh3XSlxc6OmPq8LJRJl.jpg
14696,Ugetsu,"In 16th century Japan, peasants Genjuro and Tobei sell their earthenware pots to a group of soldiers in a nearby village, in defiance of a local sage's warning against seeking to profit from warfare. Genjuro's pursuit of both riches and the mysterious Lady Wakasa, as well as Tobei's desire to become a samurai, run the risk of destroying both themselves and their wives, Miyagi and Ohama.","[14, 18, 9648]",7.995,/r8RiuKTIYIJBjczBVsfeP5C00CJ.jpg
449176,"Love, Simon","Everyone deserves a great love story, but for 17-year-old Simon Spier, it's a little more complicated. He hasn't told his family or friends that he's gay, and he doesn't know the identity of the anonymous classmate that he's fallen for online.","[35, 18, 10749]",7.994,/snIsqVPmlu4LPjvToHpDotxa7Eh.jpg
205596,The Imitation Game,"Based on the real life story of legendary cryptanalyst Alan Turing, the film portrays the nail-biting race against time by Turing and his brilliant team of code-breakers at Britain's top-secret Government Code and Cypher School at Bletchley Park, during the darkest days of World War II.","[36, 18, 53, 10752]",7.994,/zSqJ1qFq8NXFfi7JeIYMlzyR0dx.jpg
1297763,Batman Ninja vs. Yakuza League,"The Batman family has returned to the present to discover that Japan has disappeared, and a giant island - Hinomoto - is now in the sky over Gotham City.  At the top sit the Yakuza, a group of superpowered individuals who reign without honor or humanity and look suspiciously like the Justice League. Now, it’s up to Batman and his allies to save Gotham!","[16, 28]",6.686,/sVVT6GYFErVv0Lcc9NvqCu0iOxO.jpg
426063,Nosferatu,"A gothic tale of obsession between a haunted young woman and the terrifying vampire infatuated with her, causing untold horror in its wake.","[18, 27, 14]",6.706,/5qGIxdEO841C0tdY8vOdLoRVrr0.jpg
298618,The Flash,"When his attempt to save his family inadvertently alters the future, Barry Allen becomes trapped in a reality in which General Zod has returned and there are no Super Heroes to turn to. In order to save the world that he is in and return to the future that he knows, Barry's only hope is to race for his life. But will making the ultimate sacrifice be enough to reset the universe?","[12, 28, 878]",6.645,/rktDFPbfHfUbArZ6OOOKsXcv0Bm.jpg
1125257,Freakier Friday,"Years after Tess and Anna endured an identity crisis, Anna now has a daughter of her own and a soon-to-be stepdaughter. As they navigate the myriad challenges that come when two families merge, Tess and Anna discover lightning might indeed strike twice.","[14, 35, 10751]",0.0,/9wV65OmsjLAqBfDnYTkMPutXH8j.jpg
38365,Grown Ups,"After their high school basketball coach passes away, five good friends and former teammates reunite for a Fourth of July holiday weekend.",[35],6.399,/ys0LscDFAuZxfUcpH5moiPeFfXs.jpg
578,Jaws,"When the seaside community of Amity finds itself under attack by a dangerous great white shark, the town's chief of police, a young marine biologist, and a grizzled hunter embark on a desperate quest to destroy the beast before it strikes again.","[27, 53, 12]",7.673,/lxM6kqilAdpdhqUl2biYp5frUxE.jpg
585,"Monsters, Inc.","Lovable Sulley and his wisecracking sidekick Mike Wazowski are the top scare team at Monsters, Inc., the scream-processing factory in Monstropolis. When a little girl named Boo wanders into their world, it's the monsters who are scared silly, and it's up to Sulley and Mike to keep her out of sight and get her back home.","[16, 35, 10751]",7.845,/wFSpyMsp7H0ttERbxY7Trlv8xry.jpg
547513,Chespirito: El Niño Que Somos,"As a child, Roberto Gómez Bolaños dreamed of being a soccer player or an engineer; acting seemed ridiculous to him. But as time went by he discovered his true calling. First as a writer and then as an actor, he gave life to several characters, including two of the most popular in the history of Mexican television.",[99],7.818,/fBK5YTjBtyNTyToENeuSQHmLtgF.jpg
481871,Mother's Job,"A young man falls in love with his friend's mother.  Hyun-woo, who returned to the military, starts a part-time job at a bar in a difficult situation, where he meets Yoo-sun, a woman who captures the hearts of customers with her skillful ways. Then one day, Hyun-woo, who was alone with her, finds himself in a shock with his friends Min-seok and Yoo-sun. When Hyun-woo confesses the truth after a hard time, Yoo-sun asks her to keep her relationship secret. Hyun-woo, who failed to reject Min-seok's proposal to live in his own home, begins a breathtaking cohabitation with Yoo-sun.",[18],5.654,/oIoJrYsyg34fe66BWndCit1ekUD.jpg
324552,John Wick: Chapter 2,"John Wick is forced out of retirement by a former associate looking to seize control of a shadowy international assassins’ guild. Bound by a blood oath to aid him, Wick travels to Rome and does battle against some of the world’s most dangerous killers.","[28, 53, 80]",7.336,/hXWBc0ioZP3cN4zCu6SN3YHXZVO.jpg
843527,The Idea of You,"40-year-old single mom Solène begins an unexpected romance with 24-year-old Hayes Campbell, the lead singer of August Moon, the hottest boy band on the planet. As they begin a whirlwind romance, it isn't long before Hayes' superstar status poses unavoidable challenges to their relationship, and Solène soon discovers that life in the glare of his spotlight might be more than she bargained for.","[10749, 18, 35]",7.366,/Y5P4Q3q8nrruZ9aD3wXeJS2Plg.jpg
707610,Bosomy Mom,"Da-hee gets married to Min-soo who is older than her. Thanks to him, he also gets a son who is not too old, Jae-hyuk, who she tries to get acquainted with, albeit awkwardly. After staying with Na-yeon, she suddenly has to meet Jae-hyuk, and Na-yeon has a date with Jae-hyuk. Min-soo is surprised to find three people coming back home from a date. It made him angry to see his son with two women. Right away, Min-soo seeks Da-hee and asks about Na-yeon. Na-yeon met Min-soo secretly. However, Da-hee who is aware of Min-soo and Da-hee's relationship, shares this fact to Jae-hyun.","[18, 10749]",6.25,/zarhMAQRWKjjsNBR1rviIXZ5xtt.jpg
1147416,"Miraculous World: London, At the Edge of Time","To save the future from a terrible fate, Marinette becomes Chronobug and teams up with Bunnyx to defeat a mysterious opponent who travels through time. Who is this new supervillain, and why are they obsessed with exposing Marinette's secret superhero identity? Marinette's only hope is to defeat her new opponent to prevent the end of Ladybug and time itself!","[16, 12, 28, 14]",7.404,/6AtoMpHvs9pxd30KsyK8QmJ9W9M.jpg
293660,Deadpool,"The origin story of former Special Forces operative turned mercenary Wade Wilson, who, after being subjected to a rogue experiment that leaves him with accelerated healing powers, adopts the alter ego Deadpool. Armed with his new abilities and a dark, twisted sense of humor, Deadpool hunts down the man who nearly destroyed his life.","[28, 12, 35]",7.623,/3E53WEZJqP6aM84D8CckXx4pIHw.jpg
629542,The Bad Guys,"When the Bad Guys, a crew of criminal animals, are finally caught after years of heists and being the world’s most-wanted villains, Mr. Wolf brokers a deal to save them all from prison.","[10751, 35, 80, 12, 16]",7.545,/6fcFmdVLCCbf1gFt8HlC6BRj8pt.jpg
285,Pirates of the Caribbean: At World's End,"Will Turner and Elizabeth Swann join forces with the revived Captain Barbossa to free Jack Sparrow from Davy Jones' locker. The group must navigate dangerous waters, confront many foes and, ultimately, choose sides in a battle wherein piracy itself hangs in the balance.","[12, 14, 28]",7.261,/jGWpG4YhpQwVmjyHEGkxEkeRf0S.jpg
1216571,June and John,John leads an ordinary life with a monotonous routine. One day John runs into a woman on the subway who is as beautiful as she is mysterious named June. His encounter with her finally leads him to have a goal in his bumptious life.,"[10749, 53]",6.342,/xRa3VBDf9RRz26SYtCTgOu9lQK2.jpg
339877,Loving Vincent,A young man arrives at the last hometown of painter Vincent van Gogh to deliver the troubled artist's final letter and ends up investigating his final days there.,"[16, 18, 9648, 36]",7.991,/56sq57kDm7XgyXBYrgJLumo0Jac.jpg
140420,Paperman,An urban office worker finds that paper airplanes are instrumental in meeting a girl in ways he never expected.,"[16, 10751, 10749]",7.991,/9tvF744hwTm2Bn9hkDjMfEsysKz.jpg
678512,Sound of Freedom,"The story of Tim Ballard, a former US government agent, who quits his job in order to devote his life to rescuing children from global sex traffickers.","[28, 18]",7.99,/qA5kPYZA7FkVvqcEfJRoOy4kpHg.jpg
