id,title,overview,genre_ids,vote_average,poster_path
45933,The Nurse on a Military Tour,"Army Doctor Eva Marini wants to join a regiment to secure equal rights for women. So her commanding officer sends her off to a boot camp led by Renzo Montagnani, where only the most unruly soldiers end up.",[35],4.934,/zvLqUjxh9RId7YzK8Xchu8fQaHk.jpg
41513,The Smurfs,"When the evil wizard Gargamel chases the tiny blue Smurfs out of their village, they tumble from their magical world and into ours -- in fact, smack dab in the middle of Central Park. Just three apples high and stuck in the Big Apple, the Smurfs must find a way to get back to their village before Gargamel tracks them down.","[16, 10751, 12, 35, 14]",5.762,/vRhnslP2gW0QDym7BsMeSuioUfK.jpg
956,Mission: Impossible III,"Retired from active duty, and training recruits for the Impossible Mission Force, agent Ethan Hunt faces the toughest foe of his career: Owen Davian, an international broker of arms and information, who's as cunning as he is ruthless. Davian emerges to threaten Hunt and all that he holds dear – including the woman Hunt loves.","[12, 28, 53]",6.75,/vKGYCpmQyV9uHybWDzXuII8Los5.jpg
1320400,Apocalypse in the Tropics,"When does a democracy end and a theocracy begin? In Apocalypse in the Tropics, Petra Costa investigates the increasingly powerful grip Christian evangelical leaders hold over politics in Brazil. She gains extraordinary access to the country’s top political leaders, including President Lula and former president Bolsonaro, as well as to Brazil’s most famous televangelist: a magnetic pastor who aspires to play puppet master to the far-right leader.",[99],7.341,/w3jnacmMmfOem8RAgz9h1h1T4Wa.jpg
1263256,Happy Gilmore 2,Revisit Happy Gilmore's golf career after his win in the Tour Championship.,[35],10.0,/ynT06XivgBDkg7AtbDbX1dJeBGY.jpg
467407,Mind and Body,"A few years ago,  when Tomomi (Hiroko Akune) was on the way home from school, she saw her friend Keiko (Misaki Mori) about to be raped by a man. Tomomi hit the man in the head with a stone and saved Keiko.  In the present, Keiko, has buried her past, sells her body in Tokyo. One day, Keiko is contacted by Tomomi. They haven't spoken since their high school graduation. They meet and Keiko lets Tomomi stay at her apartment. Soon, the bizarre lives of the two women begins, with Tomomi also selling her body.",[18],7.556,/tJSNalCgcqfI8mbI5xFveJGTQDv.jpg
6479,I Am Legend,"Robert Neville is a scientist who was unable to stop the spread of the terrible virus that was incurable and man-made. Immune, Neville is now the last human survivor in what is left of New York City and perhaps the world. For three years, Neville has faithfully sent out daily radio messages, desperate to find any other survivors who might be out there. But he is not alone.","[18, 878, 53]",7.21,/iPDkaSdKk2jRLTM65UOEoKtsIZ8.jpg
387824,Mom's Friend,"Seong Soo, a twenty years old boy, decided to move to Seoul after being accepted into Seoul University. However, he was a victim of real estate scam. He then moves into his mother's friend's house. Moreover, it turns out that his mother's friend is a sexy self-employed mother and Seong Soo is attracted to her.",[18],7.0,/uHTE5QiHfPQLfvqgfYsgISpaqD8.jpg
55779,Final Destination 5,"Death is just as omnipresent as ever, and is unleashed after one man’s premonition saves a group of coworkers from a terrifying suspension bridge collapse. But this group of unsuspecting souls was never supposed to survive, and, in a terrifying race against time, the ill-fated group frantically tries to discover a way to escape Death’s sinister agenda.","[27, 9648]",6.144,/Akx1Po4ZLetOWfYJhQf75tbhTtK.jpg
1199974,Párvulos: Children of the Apocalypse,"In a dystopian future ravaged by a viral apocalypse, three young brothers—Salvador, Oliver, and Benjamin—find themselves isolated in a remote cabin deep within the woods. As they navigate this desolate world, they harbor a dark and disturbing secret in their basement, a presence they must feed to ensure their own survival.",[27],6.596,/pHehmoG3gbTb5RsKWOdxqLmnhpD.jpg
1229730,Carjackers,"By day, they're invisible—valets, hostesses, and bartenders at a luxury hotel. By night, they're the Carjackers, a crew of skilled drivers who track and rob wealthy clients on the road. As they plan their ultimate heist, the hotel director hires a ruthless hitman, to stop them at all costs. With danger closing in, can Nora, Zoe, Steve, and Prestance pull off their biggest score yet?","[28, 12]",6.1,/wbkPMTz2vVai7Ujyp0ag7AM9SrO.jpg
249578,Tabu,"The fictional encounter in Rio de Janeiro, Brazil (in the 30s) between popular songwriter Lamartine Babo and inconoclast poet and playwright Oswald de Andrade.","[35, 10402]",6.4,/srpnzVpigLZ5Bpwur2fabDXfB3G.jpg
329865,Arrival,"Taking place after alien crafts land around the world, an expert linguist is recruited by the military to determine whether they come in peace or are a threat.","[18, 878, 9648]",7.616,/x2FJsf1ElAgr63Y3PNPtJrcmpoe.jpg
1078600,Marked Men: Rule + Shaw,"Shaw Landon has loved Rule Archer from the moment she laid eyes on him. Rule, a fiery-tempered rebel tattoo artist, doesn’t have time for a good girl pre-med student like Shaw — even if she’s the only one who can see the person he truly is. She lives by other people’s rules; he makes his own. But a short skirt, too many birthday cocktails, and spilled secrets lead to a night neither can forget. Now, Shaw and Rule must figure out how a girl like her and a guy like him are supposed to be together without destroying their love…or each other.","[10749, 18]",6.641,/gZQU8BtCH2IbMZq6QETiU4HXQSR.jpg
1164355,Lembayung,"Arum and Pica, who wanted to complete their internship at Lembayung hospital, had to face mysterious terror from a woman satan who was suspected of hanged herself in the bathroom. The situation became even more tense after they asked others for help to the point where they threatened their own lives and those closest to them.","[27, 53]",7.2,/5x9LrW0yvtt6S3XovIQHgXfYvLL.jpg
1280,3-Iron,A drifter lives in people's houses while they are away and repays them by doing chores for them. His life changes when he meets a beautiful woman who wants to escape her unhappy marriage.,"[18, 10749, 80]",7.8,/8ens4pTquSxN7J9EgL0NOehWwdZ.jpg
31442,Ivan's Childhood,"In WW2, twelve year old Soviet orphan Ivan Bondarev works for the Soviet army as a scout behind the German lines and strikes a friendship with three sympathetic Soviet officers.","[18, 10752]",7.821,/vmRWSLP1DE9WTta0hfzIafJ0dID.jpg
2440,Joint Security Area,"Two North Korean soldiers are killed in the border area between North and South Korea, prompting an investigation by a neutral body. The sergeant is the shooter, but the lead investigator, a Swiss-Korean woman, receives differing accounts from the two sides.","[10752, 18, 53, 9648, 28]",7.821,/etoPOj0bXzfw0LBNslCxqO7MHuv.jpg
779047,Us Again,"In a vibrant city pulsating with rhythm and movement, an elderly man and his young-at-heart wife rekindle their youthful passion for life and each other on one magical night.","[16, 18, 10751, 10749]",7.8,/IP5g4EDQdvrXxlf1qbG9WQTdI6.jpg
263115,Logan,"In the near future, a weary Logan cares for an ailing Professor X in a hideout on the Mexican border. But Logan's attempts to hide from the world and his legacy are upended when a young mutant arrives, pursued by dark forces.","[28, 18, 878]",7.821,/fnbjcRDYn6YviCcePDnGdyAkYsB.jpg
11953,Kagemusha,"Akira Kurosawa's lauded feudal epic presents the tale of a petty thief who is recruited to impersonate Shingen, an aging warlord, in order to avoid attacks by competing clans. When Shingen dies, his generals reluctantly agree to have the impostor take over as the powerful ruler. He soon begins to appreciate life as Shingen, but his commitment to the role is tested when he must lead his troops into battle against the forces of a rival warlord.","[28, 18, 36, 10752]",7.821,/fJgqj9s8HNZz9zwX6femVJn8HEB.jpg
398924,A Bag of Marbles,"At the beginning of the 1940s, in a France occupied by Nazi forces, lived the Jewish Joffo family. Happy and tight-knit, she sees her future darken when all members of the family are forced to wear the yellow star. Fearing the worst, the parents organized their family to flee to the free zone in the south of the country. Maurice, twelve years old, and Joseph, ten years old, will therefore leave alone in order to maximize their chances of finding their older brothers already settled in Nice.  The brothers left to their own devices demonstrate an incredible amount of cleverness, courage, and ingenuity to escape the enemy invasion and to try to reunite their family once again.","[10752, 18]",7.82,/kjVPBXfo7frULyUzQ8NRPAflP8G.jpg
200727,"Love, Rosie","Since the moment they met at age 5, Rosie and Alex have been best friends, facing the highs and lows of growing up side by side. A fleeting shared moment, one missed opportunity, and the decisions that follow send their lives in completely different directions. As each navigates the complexities of life, love, and everything in between, they always find their way back to each other - but is it just friendship, or something more?","[10749, 18, 35]",7.82,/8Mf9GgyNv5jjLAAPGsom9skH2Du.jpg
58129,The Phantom Carriage,"An alcoholic, abusive ne'er-do-well is shown the error of his ways through a legend that dooms the last person to die on New Year's Eve before the clock strikes twelve to take the reins of Death's chariot and work tirelessly collecting fresh souls for the next year.","[18, 14, 27]",7.82,/vmhMEj2d8JnKS5jzqJf4kYypKWN.jpg
56231,The Working Class Goes to Heaven,"After losing a finger in a work accident, an Italian worker becomes increasingly involved in political and revolutionary groups.",[18],7.819,/gulAszCUPjuBtDd6NudgLTBu3i5.jpg
502,Fail Safe,Because of a technical defect an American bomber team mistakenly orders the destruction of Moscow. The President of the United States has but little time to prevent an atomic catastrophe from occurring.,"[53, 18, 10752]",7.817,/qrsj5hort5xkLOKw9NyraGMnlVP.jpg
937746,Io Capitano,"Longing for a brighter future, two Senegalese teenagers embark on a journey from West Africa to Italy. However, between their dreams and reality lies a labyrinth of checkpoints, the Sahara Desert, and the vast waters of the Mediterranean.","[12, 18]",7.813,/kGlZFwUQI5gAUdySNFfqGIkAF9n.jpg
419478,Midnight Sun,"Katie, a 17-year-old, has been sheltered since childhood and confined to her house during the day by a rare disease that makes even the smallest amount of sunlight deadly. Fate intervenes when she meets Charlie and they embark on a summer romance.","[10749, 18]",7.816,/vPG2zEKPXhovPW9S91SRnwr5JM1.jpg
152742,The Best Offer,"Virgil Oldman is a world renowned antiques expert and auctioneer. An eccentric genius, he leads a solitary life, going to extreme lengths to keep his distance from the messiness of human relationships. When appointed by the beautiful but emotionally damaged Claire to oversee the valuation and sale of her family’s priceless art collection, Virgil allows himself to form an attachment to her – and soon he is engulfed by a passion which will rock his bland existence to the core.","[18, 10749, 80]",7.814,/ibDGPgUZn6vxHiSgt2xeQyFp8Np.jpg
10775,Infernal Affairs,"Chan Wing Yan, a young police officer, has been sent undercover as a mole in the local mafia. Lau Kin Ming, a young mafia member, infiltrates the police force. Years later, their older counterparts, Chen Wing Yan and Inspector Lau Kin Ming, respectively, race against time to expose the mole within their midst.","[18, 28, 53, 80, 9648]",7.815,/gix9thDBXfjJ8M7rYbihqbQGBcP.jpg
10774,Network,"When veteran anchorman Howard Beale is forced to retire his 25-year post because of his age, he announces to viewers that he will kill himself during his farewell broadcast. Network executives rethink their decision when his fanatical tirade results in a spike in ratings.",[18],7.816,/gZ8hhuVEQ78CLND09trZJ45Eiy8.jpg
826,The Bridge on the River Kwai,"The classic story of English POWs in Burma forced to build a bridge to aid the war effort of their Japanese captors. British and American intelligence officers conspire to blow up the structure, but Col. Nicholson, the commander who supervised the bridge's construction, has acquired a sense of pride in his creation and tries to foil their plans.","[18, 36, 10752]",7.816,/7paXMt2e3Tr5dLmEZOGgFEn2Vo7.jpg
301,Rio Bravo,"A small-town sheriff in the American West enlists the help of a disabled man, a drunk, and a young gunfighter in his efforts to hold in jail the brother of the local bad guy.",[37],7.814,/4gI4KKmoi0d3yfsF71YU3S0I5t8.jpg
314365,Spotlight,"The true story of how the Boston Globe uncovered the massive scandal of child molestation and cover-up within the local Catholic Archdiocese, shaking the entire Catholic Church to its core.","[18, 36]",7.815,/8DPGG400FgaFWaqcv11n8mRd2NG.jpg
1272837,28 Years Later Part 2: The Bone Temple,The second installment in the 28 Days Later sequel trilogy. Plot TBA.,"[27, 878, 53]",0.0,/rQvneDZ7cEwmxTIX4CpVXDsb2Vp.jpg
1249213,Drop,"Violet, a widowed mother on her first date in years, arrives at an upscale restaurant where she is relieved that her date, Henry, is more charming and handsome than she expected. But their chemistry begins to curdle as Violet begins being irritated and then terrorized by a series of anonymous drops to her phone.","[9648, 53]",6.478,/hSQPSW8aLjsMBfwqGjgJ6HozTkp.jpg
297,Meet Joe Black,"Bill Parrish has it all - success, wealth and power. Days before his 65th birthday, he receives a visit from a mysterious stranger, Joe Black, who soon reveals himself as Death. In exchange for extra time, Bill agrees to serve as Joe's earthly guide. But will he regret his choice when Joe unexpectedly falls in love with Bill's beautiful daughter Susan?","[14, 18, 10749]",7.35,/fDPAjvfPMomkKF7cMRmL5Anak61.jpg
284053,Thor: Ragnarok,"Thor is imprisoned on the other side of the universe and finds himself in a race against time to get back to Asgard to stop Ragnarok, the destruction of his home-world and the end of Asgardian civilization, at the hands of a powerful new threat, the ruthless Hela.","[28, 12, 878]",7.585,/rzRwTcFvttcN1ZpX2xv4j3tSdJu.jpg
483980,Z-O-M-B-I-E-S,"Two star-crossed freshmen – a zombie, Zed and a cheerleader, Addison – each outsiders in their unique ways, befriend each other and work together to show their high school and the Seabrook community what they can achieve when they embrace their differences.","[14, 35, 10749, 10770]",7.268,/smfvg3SfpkSS0dwCq2C9bhva3A8.jpg
20352,Despicable Me,"Villainous Gru lives up to his reputation as a despicable, deplorable and downright unlikable guy when he hatches a plan to steal the moon from the sky. But he has a tough time staying on task after three orphans land in his care.","[10751, 35, 16]",7.251,/9lOloREsAhBu0pEtU0BgeR1rHyo.jpg
272,Batman Begins,"Driven by tragedy, billionaire Bruce Wayne dedicates his life to uncovering and defeating the corruption that plagues his home, Gotham City.  Unable to work within the system, he instead creates a new identity, a symbol of fear for the criminal underworld - The Batman.","[18, 80, 28]",7.714,/4MpN4kIEqUjW8OPtOQJXlTdHiJV.jpg
466420,Killers of the Flower Moon,"When oil is discovered in 1920s Oklahoma under Osage Nation land, the Osage people are murdered one by one—until the FBI steps in to unravel the mystery.","[80, 36, 18]",7.424,/dB6Krk806zeqd0YNp2ngQ9zXteH.jpg
993710,Back in Action,"Fifteen years after vanishing from the CIA to start a family, elite spies Matt and Emily jump back into the world of espionage when their cover is blown.","[28, 35]",6.454,/3L3l6LsiLGHkTG4RFB2aBA6BttB.jpg
566525,Shang-Chi and the Legend of the Ten Rings,Shang-Chi must confront the past he thought he left behind when he is drawn into the web of the mysterious Ten Rings organization.,"[28, 12, 14]",7.518,/d08HqqeBQSwN8i8MEvpsZ8Cb438.jpg
1135850,STW,Kelas Bintang is back with this pack of drama called STW.,"[18, 10749]",10.0,/zKxhwCiCf9W9fFzVsZlQJzvFkQH.jpg
37265,All Ladies Do It,"After five years of marriage, Diana discovers the joys of adultery, claiming that she can save her failing relationship through betrayal.","[35, 18]",5.0,/fVLwjwThhwvxSNGYu2rFO47yaQ9.jpg
1212855,Fight or Flight,A mercenary takes on the job of tracking down a target on a plane but must protect her when they're surrounded by people trying to kill both of them.,"[28, 35, 53]",6.086,/dNyzZaMDS5hmOzWHFgNlgRRPDB0.jpg
375834,"It's Called 'Murder', Baby","In 1940s Los Angeles, private investigator Nick Popodopolis, is hired by actress Dixie Ray, to find her blackmailer.  Edited R version of adult film, Dixie Ray Hollywood Star.",[9648],7.25,/3t0AGedAVSiVOu8614okkVRyU1i.jpg
303867,World of Tomorrow,A little girl is taken on a mind-bending tour of her distant future.,"[16, 18, 878]",7.815,/5s7DSOek7Bk2CvcG1zX01bJzJ0x.jpg
785084,The Whale,A reclusive English teacher suffering from severe obesity attempts to reconnect with his estranged teenage daughter for one last chance at redemption.,[18],7.814,/jQ0gylJMxWSL490sy0RrPj1Lj7e.jpg
33602,Temple Grandin,"A biopic of Temple Grandin, an autistic American who has become one of the leading scientists in humane livestock handling.","[18, 36]",7.813,/gQhQ6yEkUkDDo1zugpq46PJN8xZ.jpg
107,Snatch,"Unscrupulous boxing promoters, violent bookmakers, a Russian gangster, incompetent amateur robbers and supposedly Jewish jewelers fight to track down a priceless stolen diamond.","[80, 35]",7.813,/8KSDI7ijEv7QVZdIyrLw5Gnhhr8.jpg
4977,Paprika,"When a machine that allows therapists to enter their patient's dreams is stolen, all hell breaks loose. Only a young female therapist can stop it and recover it before damage is done: Paprika.","[16, 878, 53]",7.812,/bLUUr474Go1DfeN1HLjE3rnZXBq.jpg
554590,Tod@s Caen,A pair of seducers try to prove who has the best techniques while trying not to fall in love with each other.,[35],7.81,/3FldRByUqkzOPOZzsPO1PRFzbaQ.jpg
10315,Fantastic Mr. Fox,"The Fantastic Mr. Fox, bored with his current life, plans a heist against the three local farmers. The farmers, tired of sharing their chickens with the sly fox, seek revenge against him and his family.","[12, 16, 35, 10751]",7.811,/njbTizADSZg4PqeyJdDzZGooikv.jpg
3870,1900,"The epic tale of a class struggle in twentieth century Italy, as seen through the eyes of two childhood friends on opposing sides.","[18, 36]",7.809,/deWzfCC59tmtEQvKSmflDe14FvR.jpg
1018,Mulholland Drive,"Blonde Betty Elms has only just arrived in Hollywood to become a movie star when she meets an enigmatic brunette with amnesia. Meanwhile, as the two set off to solve the second woman's identity, filmmaker Adam Kesher runs into ominous trouble while casting his latest project.","[53, 18, 9648]",7.809,/x7A59t6ySylr1L7aubOQEA480vM.jpg
31011,Mr. Nobody,"Nemo Nobody leads an ordinary existence with his wife and 3 children; one day, he wakes up as a mortal centenarian in the year 2092.","[878, 18, 10749]",7.808,/qNkIONc4Rgmzo23ph7qWp9QfVnW.jpg
22683,Gifted Hands: The Ben Carson Story,Gifted Hands: The Ben Carson Story is a movie based on the life story of world-renowned neurosurgeon Ben Carson from 1961 to 1987.,[18],7.808,/4NxxtiqezjUmUxoDTOjO5FeJvFt.jpg
80,Before Sunset,"Nine years later, Jesse travels across Europe giving readings from a book he wrote about the night he spent in Vienna with Celine. After his reading in Paris, Celine finds him, and they spend part of the day together before Jesse has to again leave for a flight. They are both in relationships now, and Jesse has a son, but as their strong feelings for each other start to return, both confess a longing for more.","[18, 10749]",7.809,/94Yl2xVB7YIRK4IgA0RqYGiNgkB.jpg
29458,One Hundred Steps,"Peppino Impastato is a quick-witted lad growing up in 1970s Sicily. Despite hailing from a family with Mafia ties and living just one hundred steps from the house of local boss Tano Badalamenti, Peppino decides to expose the Mafia by using a pirate radio station to broadcast his political pronouncements in the form of ironic humour.","[18, 36]",7.806,/dpQpjLslfQlpDv7eCVRDPQAKgqs.jpg
11697,The Man Who Shot Liberty Valance,"Questions arise when Senator Stoddard attends the funeral of a local man named Tom Doniphon in a small Western town. Flashing back, we learn Doniphon saved Stoddard, then a lawyer, when he was roughed up by a crew of outlaws terrorizing the town, led by Liberty Valance. As the territory's safety hung in the balance, Doniphon and Stoddard, two of the only people standing up to him, proved to be very important, but different, foes to Valance.",[37],7.806,/4C1R0LEivLjbv3swAzJfzh0tzXl.jpg
531,The Wrong Trousers,"Wallace rents out Gromit's former bedroom to a penguin, who takes up an interest in the techno pants created by Wallace. However, Gromit later learns that the penguin is a wanted criminal.  Preserved by the Academy Film Archive.","[16, 35, 10751]",7.806,/mV8SDTjkxrDxu0a0egvFz1lRPU7.jpg
113,"Spring, Summer, Fall, Winter... and Spring","An isolated lake, where an old monk lives in a small floating temple. The monk has a young boy living with him, learning to become a monk. We watch as seasons and years pass by.",[18],7.804,/6SQQ5REuAz7k0FMQ9mSCT40T2LN.jpg
15859,A Moment to Remember,A young couple's love is tested when Sun-jin is diagnosed with a rare form of Alzheimer's disease.,"[18, 10749]",7.8,/s9ulpxLbkeJTTYxqLVUl6PreLGN.jpg
762,Monty Python and the Holy Grail,"King Arthur, accompanied by his squire, recruits his Knights of the Round Table, including Sir Bedevere the Wise, Sir Lancelot the Brave, Sir Robin the Not-Quite-So-Brave-As-Sir-Lancelot and Sir Galahad the Pure. On the way, Arthur battles the Black Knight who, despite having had all his limbs chopped off, insists he can still fight. They reach Camelot, but Arthur decides not  to enter, as ""it is a silly place"".","[12, 35, 14]",7.804,/hWx1ANiWEWWyzKPN0us35HCGnhQ.jpg
579245,The Specials,"For twenty years, Bruno and Malik have lived in a different world—the world of autistic children and teens. In charge of two separate nonprofit organizations (The Hatch & The Shelter), they train young people from underprivileged areas to be caregivers for extreme cases that have been refused by all other institutions. It’s an exceptional partnership, outside of traditional settings, for some quite extraordinary characters.","[35, 18]",7.802,/lcg4GhZCgntHSZRVFYQ1oShdpFw.jpg
18240,The Proposal,"When she learns she's in danger of losing her visa status and being deported, overbearing book editor Margaret Tate forces her put-upon assistant, Andrew Paxton, to marry her.","[35, 10749, 18]",7.158,/aEqtJDj8MvSDQwzggvcOfFTZMw.jpg
11224,Cinderella,"Cinderella has faith her dreams of a better life will come true. With help from her loyal mice friends and a wave of her Fairy Godmother's wand, Cinderella's rags are magically turned into a glorious gown and off she goes to the Royal Ball. But when the clock strikes midnight, the spell is broken, leaving a single glass slipper... the only key to the ultimate fairy-tale ending!","[10751, 14, 16, 10749]",7.047,/4nssBcQUBadCTBjrAkX46mVEKts.jpg
1724,The Incredible Hulk,"Scientist Bruce Banner scours the planet for an antidote to the unbridled force of rage within him: the Hulk. But when the military masterminds who dream of exploiting his powers force him back to civilization, he finds himself coming face to face with a new, deadly foe.","[878, 28, 12]",6.224,/gKzYx79y0AQTL4UAk1cBQJ3nvrm.jpg
20760,Lilo & Stitch 2: Stitch Has a Glitch,"Now, we find the rowdy extraterrestrial getting used to life with his new ʻohana. However, a malfunction in the ultimate creation of Dr. Jumba soon emerges, which reinstates his destructive programming and threatens to both ruin his friendship with Lilo and to short him out for good!","[16, 10751, 35, 878]",6.7,/p2R4mhZcikWEBlqv80VfJ7M9xql.jpg
884605,No Hard Feelings,"On the brink of losing her childhood home, Maddie discovers an intriguing job listing: wealthy helicopter parents looking for someone to “date” their introverted 19-year-old son, Percy, before he leaves for college. To her surprise, Maddie soon discovers the awkward Percy is no sure thing.","[35, 10749]",6.727,/gD72DhJ7NbfxvtxGiAzLaa0xaoj.jpg
19173,Diary of a Nymphomaniac,"A chronicle of the life of a middle-class French girl's sexual adventures, her then fall into prostitution, and her ultimate redemption.","[18, 10749]",5.647,/yVYTeiFv7oQsSQF9OBRngg7ZqLg.jpg
762441,A Quiet Place: Day One,"As New York City is invaded by alien creatures who hunt by sound, a woman named Sam fights to survive with her cat.","[27, 878, 53]",6.717,/hU42CRk14JuPEdqZG3AWmagiPAP.jpg
447332,A Quiet Place,A family is forced to live in silence while hiding from creatures that hunt by sound.,"[27, 18, 878]",7.398,/nAU74GmpUk7t5iklEp3bufwDq4n.jpg
957452,The Crow,"Soulmates Eric and Shelly are brutally murdered when the demons of her dark past catch up with them. Given the chance to save his true love by sacrificing himself, Eric sets out to seek merciless revenge on their killers, traversing the worlds of the living and the dead to put the wrong things right.","[28, 14, 27]",5.84,/g8TbOXrNMuqq7AaKqdvqS2oG4ob.jpg
746036,The Fall Guy,"Fresh off an almost career-ending accident, stuntman Colt Seavers has to track down a missing movie star, solve a conspiracy and try to win back the love of his life while still doing his day job.","[28, 35, 18, 10749]",7.013,/e7olqFmzcIX5c23kX4zSmLPJi8c.jpg
